{
  "runtimeId": "barony-bml-runtime-stash",
  "runtimeVersion": "0.1.0",
  "runtimeName": "BaronyModLoader Stash-capable runtime",
  "gameRevision": "git-sha-or-release-id",
  "contractVersions": [
    "0.1.0"
  ],
  "executable": "/path/to/barony",
  "game": {
    "id": "barony",
    "name": "Barony",
    "supportedVersions": [
      "5.x"
    ],
    "revision": "git-sha-or-release-id"
  },
  "contract": {
    "id": "bml-runtime-contract",
    "versions": [
      "0.1.0"
    ]
  },
  "platforms": [
    {
      "platform": "linux-x86_64",
      "executable": "/path/to/barony",
      "artifact": "native/release/linux-x86_64/barony",
      "sha256": "0000000000000000000000000000000000000000000000000000000000000000"
    }
  ],
  "capabilities": [
    {
      "id": "persistent_storage",
      "version": "0.1.0",
      "requiredForStash": true,
      "description": "Profile-scoped engine-managed storage for mod state."
    },
    {
      "id": "persistent_inventory",
      "version": "0.1.0",
      "requiredForStash": true,
      "description": "Named inventory state that survives run, save, and process boundaries."
    },
    {
      "id": "void_chest_binding",
      "version": "0.1.0",
      "requiredForStash": true,
      "description": "Authoritative binding from Barony Void Chest access paths to a persistent inventory."
    },
    {
      "id": "placement_lobby",
      "version": "0.1.0",
      "requiredForStash": true,
      "description": "Safe deterministic placement of a Void Chest access point in the lobby."
    },
    {
      "id": "placement_shop",
      "version": "0.1.0",
      "requiredForStash": true,
      "description": "Safe deterministic placement of a Void Chest access point in generated shops."
    },
    {
      "id": "multiplayer_version_metadata",
      "version": "0.1.0",
      "requiredForStash": true,
      "description": "Host/client compatibility metadata for package, runtime, and persistent inventory schema versions."
    }
  ],
  "moduleSupport": [
    "persistentStorage",
    "persistentInventories",
    "voidChestBindings",
    "placements",
    "multiplayer"
  ],
  "runtimeReportPaths": {
    "runtimeManifest": "BaronyModLoader/runtime-manifest.json",
    "runtimeLoadReport": "BaronyModLoader/reports/runtime-load-report.json",
    "runtimeLog": "BaronyModLoader/logs/runtime.log",
    "stateRoot": "BaronyModLoader/state/"
  },
  "policy": {
    "requiresValidatedManifest": true,
    "rejectsUnknownRequiredCapabilities": true,
    "partialStashLoadAllowed": false
  }
}
